{
  "id": "evt_decision_barter_offer",
  "name_zh": "以物易物",
  "kind": "decision",
  "weight": 40,
  "triggers": {
    "all_of": [
      {
        "op": "time_in_range",
        "day_from": 8,
        "day_to": 16
      }
    ]
  },
  "effects": [
    {
      "op": "set_flag",
      "flag": "barter_offer_seen",
      "value": true
    }
  ],
  "options": [
    {
      "label_zh": "用布换罐头",
      "weight": 60,
      "effects": [
        {
          "op": "item_remove",
          "item_id": "itm_cloth_rag",
          "qty": 2
        },
        {
          "op": "item_add",
          "item_id": "itm_canned_food",
          "qty": 1
        }
      ]
    },
    {
      "label_zh": "拒绝交易",
      "weight": 40,
      "effects": [
        {
          "op": "stat_add",
          "target": "community",
          "stat": "morale",
          "amount": 0
        }
      ]
    }
  ],
  "tags": [
    "trade",
    "decision"
  ]
}