{
  "id": "evt_clinic_run_outcome",
  "name_zh": "诊所行动结果",
  "kind": "scene",
  "weight": 50,
  "triggers": {
    "all_of": [
      {"op": "time_in_range", "day_from": 4, "day_to": 9}
    ]
  },
  "effects": [
    {"op": "item_add", "item_id": "itm_antibiotics", "qty": 1},
    {"op": "set_flag", "flag": "clinic_run_done", "value": true}
  ],
  "tags": ["injury", "poi", "clinic"],
  "cooldown_days": 1,
  "max_fires": 1
}