{
  "id": "evt_decision_wounded_stranger",
  "name_zh": "受伤的陌生人",
  "kind": "decision",
  "weight": 40,
  "triggers": {
    "all_of": [
      {
        "op": "time_in_range",
        "day_from": 6,
        "day_to": 14
      }
    ]
  },
  "effects": [
    {
      "op": "set_flag",
      "flag": "wounded_stranger_seen",
      "value": true
    }
  ],
  "options": [
    {
      "label_zh": "使用绷带救助",
      "weight": 55,
      "effects": [
        {
          "op": "item_remove",
          "item_id": "itm_bandage",
          "qty": 1
        },
        {
          "op": "spawn_npc",
          "target": "stranger_ally"
        }
      ]
    },
    {
      "label_zh": "见死不救",
      "weight": 45,
      "effects": [
        {
          "op": "stat_add",
          "target": "community",
          "stat": "morale",
          "amount": -2
        }
      ]
    }
  ],
  "tags": [
    "social",
    "medical",
    "decision"
  ]
}