{
  "id": "evt_decision_medical_stock",
  "name_zh": "医疗库存",
  "kind": "decision",
  "weight": 40,
  "triggers": {
    "all_of": [
      {
        "op": "time_in_range",
        "day_from": 6,
        "day_to": 16
      }
    ]
  },
  "effects": [
    {
      "op": "set_flag",
      "flag": "medical_stock_seen",
      "value": true
    }
  ],
  "options": [
    {
      "label_zh": "搜寻药房",
      "weight": 60,
      "effects": [
        {
          "op": "queue_event",
          "event_id": "evt_clinic_run_outcome"
        }
      ]
    },
    {
      "label_zh": "节约用药",
      "weight": 40,
      "effects": [
        {
          "op": "stat_add",
          "target": "community",
          "stat": "morale",
          "amount": -1
        }
      ]
    }
  ],
  "tags": [
    "medical",
    "decision"
  ]
}