{
  "id": "evt_decision_radio_signal",
  "name_zh": "不明信号",
  "kind": "decision",
  "weight": 35,
  "triggers": {
    "all_of": [
      {
        "op": "time_in_range",
        "day_from": 5,
        "day_to": 14
      }
    ]
  },
  "effects": [
    {
      "op": "set_flag",
      "flag": "radio_signal_seen",
      "value": true
    }
  ],
  "options": [
    {
      "label_zh": "回应信号",
      "weight": 60,
      "effects": [
        {
          "op": "queue_event",
          "event_id": "evt_radio_rumour"
        }
      ]
    },
    {
      "label_zh": "保持静默",
      "weight": 40,
      "effects": [
        {
          "op": "stat_add",
          "target": "community",
          "stat": "morale",
          "amount": -1
        }
      ]
    }
  ],
  "tags": [
    "broadcast",
    "decision"
  ]
}