{
  "id": "evt_decision_refugee_group",
  "name_zh": "难民群体",
  "kind": "decision",
  "weight": 45,
  "triggers": {
    "all_of": [
      {
        "op": "time_in_range",
        "day_from": 7,
        "day_to": 16
      }
    ]
  },
  "effects": [
    {
      "op": "set_flag",
      "flag": "refugees_seen",
      "value": true
    }
  ],
  "options": [
    {
      "label_zh": "分享食物",
      "weight": 55,
      "effects": [
        {
          "op": "item_remove",
          "item_id": "itm_canned_food",
          "qty": 2
        },
        {
          "op": "stat_add",
          "target": "community",
          "stat": "morale",
          "amount": 2
        }
      ]
    },
    {
      "label_zh": "驱赶他们",
      "weight": 45,
      "effects": [
        {
          "op": "stat_add",
          "target": "community",
          "stat": "morale",
          "amount": -2
        }
      ]
    }
  ],
  "tags": [
    "social",
    "decision"
  ]
}